{
  "$schema": "https://json-schema.org/draft/2020-12/schema",
  "title": "dependency-model:synthesis contract",
  "description": "The envelope `synthesize` emits: the merged discovery inventory plus the graph and health view derived from it. report, #50, and #51 consume this. Judgment about which conditions matter belongs to those consumers, not to this contract.",
  "type": "object",
  "required": ["contract_version", "target", "inventory", "graph", "health", "assumptions"],
  "properties": {
    "contract_version": { "type": "string" },
    "target": {
      "type": "string",
      "description": "Absolute path of the repository this was synthesized from."
    },
    "ref": {
      "type": ["object", "null"],
      "description": "The git ref this was synthesized from, as depscan.py --ref recorded it. Absent or null means the working tree, uncommitted edits included.",
      "required": ["name", "commit"],
      "properties": {
        "name": { "type": "string", "description": "The ref as given, e.g. main." },
        "commit": { "type": "string", "description": "The commit SHA it resolved to." }
      }
    },
    "components": {
      "type": "array",
      "description": "The system's own first-party components, copied from the profile:topology contract's components[] with an id added. They are what the inventory's dependencies are depended on by, so they are graph nodes (category `component`) and health anchors, but never inventory entries. Absent or empty when no topology was supplied.",
      "items": {
        "type": "object",
        "additionalProperties": false,
        "required": ["id", "name", "role", "evidence"],
        "properties": {
          "id": { "type": "string", "description": "'component:<slug>', the slug rule in references/categories.md (Ids) applied to the topology component's name." },
          "name": { "type": "string" },
          "role": { "type": ["string", "null"] },
          "evidence": { "type": "array", "items": { "type": "string" } }
        }
      }
    },
    "inventory": {
      "type": "object",
      "required": ["categories"],
      "description": "The discovery envelopes for this target, merged by key union across whichever discovery skills ran.",
      "properties": {
        "categories": {
          "type": "object",
          "additionalProperties": false,
          "properties": {
            "config": { "$ref": "config.schema.json" },
            "network": { "$ref": "network.schema.json" },
            "package": { "$ref": "package.schema.json" },
            "platform": { "$ref": "platform.schema.json" },
            "security": { "$ref": "security.schema.json" },
            "service": { "$ref": "service.schema.json" }
          }
        }
      }
    },
    "graph": {
      "type": "object",
      "additionalProperties": false,
      "required": ["nodes", "edges", "cycles"],
      "description": "The dependency graph derived from the inventory: one node per discovered dependency, one per first-party component, one edge per relationship between them.",
      "properties": {
        "nodes": {
          "type": "array",
          "items": {
            "type": "object",
            "additionalProperties": false,
            "required": ["id", "name", "category", "lifecycle"],
            "properties": {
              "id": {
                "type": "string",
                "description": "Same id as the corresponding inventory dependency, '<category>:<slug>'; or a components[] id."
              },
              "name": { "type": "string" },
              "category": {
                "enum": ["config", "network", "package", "platform", "security", "service", "component"],
                "description": "The inventory category, or `component` for a first-party component from components[] -- not a dependency, so it has no inventory entry."
              },
              "lifecycle": { "enum": ["build", "run"], "description": "Always run for a component node: the component is the running thing." }
            }
          }
        },
        "edges": {
          "type": "array",
          "items": {
            "type": "object",
            "additionalProperties": false,
            "required": ["from", "to", "kind", "lifecycle"],
            "properties": {
              "from": { "type": "string" },
              "to": { "type": "string" },
              "kind": {
                "enum": ["depends_on", "relates_to"],
                "description": "depends_on: one dependency requires another to function, e.g. a package's transitive dependency. relates_to: two dependencies are the same real-world thing seen from different categories, e.g. a service and the network port that reaches it -- the correlation `related_ids` already carries, made explicit as an edge."
              },
              "lifecycle": {
                "enum": ["build", "run"],
                "description": "The source node's (`from`) lifecycle, propagated onto the edge -- not a constant per `kind`. A package depended on only at build time produces a `build` edge; one that ships at runtime produces `run`, whatever the edge's `kind`."
              }
            }
          }
        },
        "cycles": {
          "type": "array",
          "description": "Each entry is a list of node ids forming one cycle in the depends_on graph. Empty when none were found.",
          "items": {
            "type": "array",
            "items": { "type": "string" }
          }
        }
      }
    },
    "health": {
      "type": "array",
      "description": "One entry per anchor -- a `run` service, or a first-party component -- that carries failure-relevant conditions, gathered from the inventory's resilience facts and related dependencies. No entry means no conditions were found, not that the anchor is fine.",
      "items": {
        "type": "object",
        "additionalProperties": false,
        "required": ["service_id", "conditions"],
        "properties": {
          "service_id": {
            "type": "string",
            "description": "The graph node id this health entry describes: a `run` service ('service:<slug>') or a first-party component ('component:<slug>', from components[]). The field name predates component anchors and is kept for compatibility."
          },
          "conditions": {
            "type": "array",
            "items": {
              "type": "object",
              "additionalProperties": false,
              "required": ["kind", "subject_id", "expectation", "required_for", "evidence"],
              "properties": {
                "kind": {
                  "enum": ["presence", "bound", "upstream_health"],
                  "description": "presence: subject_id must exist/resolve, e.g. a network path or a config key. bound: subject_id carries a declared limit, e.g. a timeout or retry count. upstream_health: subject_id's own health entry feeds this one, e.g. a service that depends on another service. Uniform on purpose: a consumer that ANDed two special-cased lists (a 'requires' list and a 'bounds' list) would be encoding a met/unmet-AND-within/outside binary that real systems don't have a middle for. That vocabulary is deliberately not defined here -- see the contract's no-state-vocabulary rule."
                },
                "subject_id": {
                  "type": "string",
                  "description": "The id this condition is about -- a graph node id, or another identifier the evidence points at."
                },
                "expectation": {
                  "type": ["object", "null"],
                  "description": "The declaration found in the repository, or null. null means no declaration was found -- it never means no bound is needed. Whether an unbounded request-path dependency is a real gap is a judgment for a later layer, not this contract.",
                  "required": ["value", "evidence"],
                  "additionalProperties": false,
                  "properties": {
                    "value": { "type": "string" },
                    "evidence": { "type": "array", "items": { "type": "string" } }
                  }
                },
                "required_for": {
                  "type": "array",
                  "description": "Ids of the components ('component:<slug>', from components[]) or functions that need this condition met, from static evidence. Records which callers depend on it, never how important any of them are; may be empty when no caller could be established.",
                  "items": { "type": "string" }
                },
                "evidence": {
                  "type": "array",
                  "description": "Locations that prove this condition exists, as 'file:line'.",
                  "items": { "type": "string" }
                }
              }
            }
          }
        }
      }
    },
    "assumptions": {
      "type": "array",
      "items": {
        "type": "object",
        "required": ["claim", "why_unconfirmed"],
        "properties": {
          "claim": { "type": "string" },
          "why_unconfirmed": { "type": "string" }
        }
      }
    }
  }
}
